unique_id,use_case
1,Enhance test documentation creation - plans reports amendments; also query documentation for analytics.
2,Improve customer support by automating responses to common queries and providing instant assistance.
3,Optimize legal document drafting by generating contracts agreements and legal briefs with LLM assistance.
4,Enable smart content generation for marketing materials - ad copies product descriptions and blog posts.
5,Enhance medical record summarization to assist healthcare professionals in extracting key information quickly.
6,Automate software code commenting and documentation generation to improve code readability and understanding.
7,Support financial analysts in generating reports forecasts and analyzing market trends using LLM capabilities.
8,Facilitate personalized e-learning content creation adapting materials based on individual student needs.
9,Assist researchers in literature review processes by summarizing and extracting key information from academic papers.
10,Enable intelligent data extraction from unstructured sources improving data processing and analysis efficiency.
11,Enhance human resources tasks - resume screening employee feedback analysis and policy drafting.
12,Improve business intelligence by automating the analysis of market reports competitor information and industry trends.
13,Facilitate sentiment analysis for social media monitoring and customer feedback to gauge public perception.
14,Support patent analysis by extracting relevant information and identifying potential infringements in large patent datasets.
15,Automate the generation of creative writing - poetry short stories and content for entertainment purposes.
16,Assist in creating personalized health and fitness plans by analyzing individual health data and preferences.
17,Optimize energy consumption analysis by processing and summarizing data from IoT devices and sensors.
18,Automate the generation of conversational agents for virtual assistants customer service bots and chatbots.
19,Enhance cybersecurity by analyzing and summarizing security alerts identifying potential threats and suggesting countermeasures.
20,Improve supply chain management by analyzing and summarizing data on inventory demand and logistics.
